{
  "schema_version": "1.0.0",
  "systems": [
    {
      "id": "apache-tika",
      "name": "Apache Tika",
      "category": "library",
      "description": "Broad content detection and text/metadata extraction across heterogeneous document and binary formats.",
      "homepage": "https://tika.apache.org/",
      "maturity": {
        "status": "active",
        "observed_on": "2026-09-25"
      },
      "licensing": {
        "model": "Apache-2.0"
      },
      "default_boundaries": [
        "file-cli",
        "process-rpc",
        "library-ffi"
      ]
    },
    {
      "id": "souffle",
      "name": "Soufflé",
      "aliases": [
        "Soufflé Datalog"
      ],
      "category": "dsl",
      "description": "Datalog system specialized for high-performance recursive relational and static-analysis workloads.",
      "homepage": "https://souffle-lang.github.io/",
      "maturity": {
        "status": "active",
        "observed_on": "2026-09-25"
      },
      "licensing": {
        "model": "UPL-1.0"
      },
      "default_boundaries": [
        "file-cli",
        "generated-artifact",
        "subsystem-language"
      ]
    },
    {
      "id": "roslyn",
      "name": "Roslyn",
      "aliases": [
        ".NET Compiler Platform"
      ],
      "category": "compiler",
      "description": "Compiler APIs exposing C# and Visual Basic syntax, symbols, binding, semantic models, diagnostics, and code transformations.",
      "homepage": "https://github.com/dotnet/roslyn",
      "maturity": {
        "status": "active",
        "observed_on": "2026-09-25"
      },
      "licensing": {
        "model": "MIT"
      },
      "default_boundaries": [
        "library-ffi",
        "process-rpc"
      ]
    },
    {
      "id": "tree-sitter",
      "name": "Tree-sitter",
      "category": "library",
      "description": "Incremental, error-tolerant concrete syntax parsing designed for source files that may be incomplete or changing.",
      "homepage": "https://tree-sitter.github.io/tree-sitter/",
      "maturity": {
        "status": "active",
        "observed_on": "2026-09-25"
      },
      "licensing": {
        "model": "MIT"
      },
      "default_boundaries": [
        "library-ffi"
      ]
    },
    {
      "id": "cue",
      "name": "CUE",
      "category": "dsl",
      "description": "Constraint/unification language that combines configuration values, schemas, defaults, validation, and composition.",
      "homepage": "https://cuelang.org/",
      "maturity": {
        "status": "active",
        "observed_on": "2026-09-25"
      },
      "licensing": {
        "model": "Apache-2.0"
      },
      "default_boundaries": [
        "file-cli",
        "subsystem-language"
      ]
    },
    {
      "id": "pandoc",
      "name": "Pandoc",
      "category": "executable",
      "description": "Structured document conversion engine spanning many markup, publishing, and document formats.",
      "homepage": "https://pandoc.org/",
      "maturity": {
        "status": "active",
        "observed_on": "2026-09-25"
      },
      "licensing": {
        "model": "GPL-2.0-or-later"
      },
      "default_boundaries": [
        "file-cli"
      ]
    },
    {
      "id": "apache-lucene",
      "name": "Apache Lucene",
      "category": "library",
      "description": "Embedded full-text search/indexing library with mature analyzers, ranking, faceting, query machinery, and vector search.",
      "homepage": "https://lucene.apache.org/",
      "maturity": {
        "status": "active",
        "observed_on": "2026-09-25"
      },
      "licensing": {
        "model": "Apache-2.0"
      },
      "default_boundaries": [
        "library-ffi",
        "process-rpc"
      ]
    },
    {
      "id": "ffmpeg",
      "name": "FFmpeg",
      "category": "executable",
      "description": "Media probing, demuxing, transcoding, filtering, streaming, and codec orchestration across a very broad format surface.",
      "homepage": "https://ffmpeg.org/",
      "maturity": {
        "status": "active",
        "observed_on": "2026-09-25"
      },
      "licensing": {
        "model": "LGPL/GPL depending on build",
        "notes": "Deployment obligations depend on enabled components and build configuration."
      },
      "default_boundaries": [
        "file-cli",
        "library-ffi"
      ]
    },
    {
      "id": "gdal",
      "name": "GDAL",
      "category": "library",
      "description": "Geospatial raster/vector format access, coordinate transformation, reprojection, and conversion infrastructure.",
      "homepage": "https://gdal.org/",
      "maturity": {
        "status": "active",
        "observed_on": "2026-09-25"
      },
      "licensing": {
        "model": "MIT-style"
      },
      "default_boundaries": [
        "file-cli",
        "library-ffi"
      ]
    },
    {
      "id": "jq",
      "name": "jq",
      "category": "dsl",
      "description": "Compact functional query and transformation language specialized for JSON streams and structured pipeline surgery.",
      "homepage": "https://jqlang.org/",
      "maturity": {
        "status": "active",
        "observed_on": "2026-09-25"
      },
      "licensing": {
        "model": "MIT"
      },
      "default_boundaries": [
        "file-cli"
      ]
    },
    {
      "id": "opa-rego",
      "name": "OPA / Rego",
      "aliases": [
        "Open Policy Agent",
        "Rego"
      ],
      "category": "dsl",
      "description": "Policy-as-code engine for evaluating shared declarative policy over arbitrary structured input.",
      "homepage": "https://www.openpolicyagent.org/",
      "maturity": {
        "status": "active",
        "observed_on": "2026-09-25"
      },
      "licensing": {
        "model": "Apache-2.0"
      },
      "default_boundaries": [
        "process-rpc",
        "library-ffi"
      ]
    },
    {
      "id": "racket-redex",
      "name": "Racket / Redex",
      "aliases": [
        "Redex"
      ],
      "category": "library",
      "description": "Executable operational-semantics framework for defining, reducing, testing, and exploring programming-language models.",
      "homepage": "https://redex.racket-lang.org/",
      "maturity": {
        "status": "active",
        "observed_on": "2026-09-25"
      },
      "licensing": {
        "model": "Racket licensing"
      },
      "default_boundaries": [
        "spec-artifact",
        "subsystem-language"
      ]
    },
    {
      "id": "z3",
      "name": "Z3",
      "category": "solver",
      "description": "General SMT solver covering combinations of Boolean, arithmetic, bit-vector, array, datatype, and uninterpreted-function theories.",
      "homepage": "https://github.com/Z3Prover/z3",
      "maturity": {
        "status": "active",
        "observed_on": "2026-09-25"
      },
      "licensing": {
        "model": "MIT"
      },
      "default_boundaries": [
        "process-rpc",
        "library-ffi"
      ]
    },
    {
      "id": "cvc5",
      "name": "cvc5",
      "category": "solver",
      "description": "General SMT theorem prover with broad theory support and value as an independent solver/reference implementation.",
      "homepage": "https://cvc5.github.io/",
      "maturity": {
        "status": "active",
        "observed_on": "2026-09-25"
      },
      "licensing": {
        "model": "BSD-3-Clause"
      },
      "default_boundaries": [
        "process-rpc",
        "library-ffi"
      ]
    },
    {
      "id": "minizinc",
      "name": "MiniZinc",
      "category": "dsl",
      "description": "Solver-independent high-level constraint modeling language for scheduling, allocation, finite-domain, and optimization problems.",
      "homepage": "https://www.minizinc.org/",
      "maturity": {
        "status": "active",
        "observed_on": "2026-09-25"
      },
      "licensing": {
        "model": "MPL-2.0"
      },
      "default_boundaries": [
        "file-cli",
        "spec-artifact"
      ]
    },
    {
      "id": "clingo",
      "name": "clingo",
      "aliases": [
        "Answer Set Programming",
        "ASP"
      ],
      "category": "solver",
      "description": "Grounder and solver for answer-set programming, suited to combinatorial world construction with defaults and exceptions.",
      "homepage": "https://potassco.org/clingo/",
      "maturity": {
        "status": "active",
        "observed_on": "2026-09-25"
      },
      "licensing": {
        "model": "MIT"
      },
      "default_boundaries": [
        "file-cli",
        "process-rpc"
      ]
    },
    {
      "id": "swi-prolog",
      "name": "SWI-Prolog",
      "category": "language",
      "description": "Mature Prolog system with constraint libraries for goal-directed relational search and partially instantiated terms.",
      "homepage": "https://www.swi-prolog.org/",
      "maturity": {
        "status": "active",
        "observed_on": "2026-09-25"
      },
      "licensing": {
        "model": "BSD-2-Clause"
      },
      "default_boundaries": [
        "process-rpc",
        "subsystem-language"
      ]
    },
    {
      "id": "tla-plus",
      "name": "TLA+ / PlusCal / TLC",
      "aliases": [
        "TLA+",
        "PlusCal",
        "TLC"
      ],
      "category": "model-checker",
      "description": "Specification and model-checking ecosystem for concurrent and distributed state-transition systems.",
      "homepage": "https://lamport.azurewebsites.net/tla/tla.html",
      "maturity": {
        "status": "stable",
        "observed_on": "2026-09-25"
      },
      "licensing": {
        "model": "MIT/BSD-style ecosystem licensing"
      },
      "default_boundaries": [
        "spec-artifact"
      ]
    },
    {
      "id": "alloy",
      "name": "Alloy",
      "category": "model-checker",
      "description": "Relational modeling language and bounded model finder for structural invariants, graphs, ownership, cardinality, and counterexamples.",